{
  "$schema": "https://json-schema.org/draft/2020-12/schema",
  "$id": "https://crypto-lending.invalid/schemas/acm-dns-control-record-v1.json",
  "title": "KAN-230 ACM and DNS control record",
  "type": "object",
  "additionalProperties": false,
  "required": [
    "schemaVersion",
    "status",
    "recordId",
    "approvedAt",
    "expiresAt",
    "aws",
    "hostname",
    "certificate",
    "dnsChange",
    "costBoundary",
    "authority",
    "independentVerification",
    "evidence"
  ],
  "properties": {
    "schemaVersion": { "const": 1 },
    "status": { "enum": ["NOT_APPROVED", "APPROVED"] },
    "recordId": { "$ref": "#/$defs/referenceOrNotApproved" },
    "approvedAt": { "$ref": "#/$defs/instantOrNotApproved" },
    "expiresAt": { "$ref": "#/$defs/instantOrNotApproved" },
    "aws": {
      "type": "object",
      "additionalProperties": false,
      "required": ["accountId", "region", "approvedRoleArn"],
      "properties": {
        "accountId": {
          "anyOf": [{ "const": "NOT_APPROVED" }, { "type": "string", "pattern": "^[0-9]{12}$" }]
        },
        "region": {
          "anyOf": [
            { "const": "NOT_APPROVED" },
            { "type": "string", "pattern": "^[a-z]{2}(?:-gov)?-[a-z]+-[0-9]$" }
          ]
        },
        "approvedRoleArn": {
          "anyOf": [
            { "const": "NOT_APPROVED" },
            {
              "type": "string",
              "pattern": "^arn:(?:aws|aws-us-gov|aws-cn):iam::[0-9]{12}:role/[A-Za-z0-9+=,.@_/-]{1,512}$"
            }
          ]
        }
      }
    },
    "hostname": {
      "type": "object",
      "additionalProperties": false,
      "required": [
        "applicationHostname",
        "parentDomain",
        "dnsProvider",
        "dnsZoneMode",
        "existingZoneReference",
        "ownershipReference"
      ],
      "properties": {
        "applicationHostname": { "$ref": "#/$defs/hostnameOrNotApproved" },
        "parentDomain": { "$ref": "#/$defs/hostnameOrNotApproved" },
        "dnsProvider": { "$ref": "#/$defs/referenceOrNotApproved" },
        "dnsZoneMode": {
          "enum": ["NOT_APPROVED", "EXISTING_EXTERNAL", "EXISTING_ROUTE53"]
        },
        "existingZoneReference": { "$ref": "#/$defs/referenceOrNotApproved" },
        "ownershipReference": { "$ref": "#/$defs/referenceOrNotApproved" }
      }
    },
    "certificate": {
      "type": "object",
      "additionalProperties": false,
      "required": [
        "mode",
        "validationMethod",
        "certificateArn",
        "subjectAlternativeNames",
        "certificateStatus",
        "notAfterUtc",
        "sha256Fingerprint",
        "renewalOwner",
        "renewalMethod",
        "renewalWindowDays"
      ],
      "properties": {
        "mode": { "enum": ["NOT_APPROVED", "ACM_INTEGRATED_NON_EXPORTABLE"] },
        "validationMethod": { "enum": ["NOT_APPROVED", "DNS"] },
        "certificateArn": {
          "anyOf": [
            { "const": "NOT_RUN" },
            {
              "type": "string",
              "pattern": "^arn:(?:aws|aws-us-gov|aws-cn):acm:[a-z0-9-]+:[0-9]{12}:certificate/[A-Za-z0-9-]+$"
            }
          ]
        },
        "subjectAlternativeNames": {
          "type": "array",
          "minItems": 1,
          "uniqueItems": true,
          "items": {
            "anyOf": [{ "const": "NOT_RUN" }, { "$ref": "#/$defs/hostname" }]
          }
        },
        "certificateStatus": { "enum": ["NOT_RUN", "ISSUED"] },
        "notAfterUtc": { "$ref": "#/$defs/instantOrNotRun" },
        "sha256Fingerprint": {
          "anyOf": [{ "const": "NOT_RUN" }, { "type": "string", "pattern": "^[a-f0-9]{64}$" }]
        },
        "renewalOwner": { "$ref": "#/$defs/roleAliasOrNotApproved" },
        "renewalMethod": { "enum": ["NOT_APPROVED", "AWS_MANAGED"] },
        "renewalWindowDays": {
          "anyOf": [
            { "const": "NOT_APPROVED" },
            { "type": "string", "pattern": "^(?:[1-9]|[1-8][0-9]|90)$" }
          ]
        }
      }
    },
    "dnsChange": {
      "type": "object",
      "additionalProperties": false,
      "required": [
        "recordType",
        "ttlSeconds",
        "applicationLoadBalancerArn",
        "targetLoadBalancerDnsName",
        "targetLoadBalancerCanonicalHostedZoneId",
        "previousRecordValue",
        "previousTtlSeconds",
        "rollbackDeadlineUtc"
      ],
      "properties": {
        "recordType": { "enum": ["NOT_APPROVED", "A_ALIAS", "CNAME"] },
        "ttlSeconds": {
          "anyOf": [
            { "const": "NOT_APPROVED" },
            { "const": "NOT_APPLICABLE" },
            {
              "type": "string",
              "pattern": "^(?:[6-9][0-9]|[1-9][0-9]{2,3}|[1-7][0-9]{4}|8[0-5][0-9]{3}|86[0-3][0-9]{2}|86400)$"
            }
          ]
        },
        "applicationLoadBalancerArn": {
          "anyOf": [
            { "const": "NOT_RUN" },
            {
              "type": "string",
              "pattern": "^arn:(?:aws|aws-us-gov|aws-cn):elasticloadbalancing:[a-z0-9-]+:[0-9]{12}:loadbalancer/app/[A-Za-z0-9-]+/[a-f0-9]+$"
            }
          ]
        },
        "targetLoadBalancerDnsName": { "$ref": "#/$defs/hostnameOrNotRun" },
        "targetLoadBalancerCanonicalHostedZoneId": {
          "anyOf": [{ "const": "NOT_RUN" }, { "type": "string", "pattern": "^Z[A-Z0-9]{1,31}$" }]
        },
        "previousRecordValue": {
          "anyOf": [
            { "const": "NOT_RUN" },
            { "const": "NO_PRIOR_RECORD" },
            { "$ref": "#/$defs/hostname" }
          ]
        },
        "previousTtlSeconds": {
          "anyOf": [
            { "enum": ["NOT_RUN", "NOT_APPLICABLE"] },
            { "type": "string", "pattern": "^[1-9][0-9]{0,4}$" }
          ]
        },
        "rollbackDeadlineUtc": { "$ref": "#/$defs/instantOrNotRun" }
      }
    },
    "costBoundary": {
      "type": "object",
      "additionalProperties": false,
      "required": [
        "decision",
        "domainRegistration",
        "hostedZoneCreation",
        "exportableCertificate",
        "privateCertificateAuthority",
        "paidMonitoring",
        "estimatedMonthlyIncrementUsd",
        "pricingAsOf",
        "pricingExpiresAt",
        "pricingSourceReference"
      ],
      "properties": {
        "decision": {
          "enum": ["NOT_APPROVED", "NO_ADDITIONAL_CHARGE_CONFIRMED"]
        },
        "domainRegistration": { "const": "NOT_AUTHORIZED" },
        "hostedZoneCreation": { "const": "NOT_AUTHORIZED" },
        "exportableCertificate": { "const": "NOT_AUTHORIZED" },
        "privateCertificateAuthority": { "const": "NOT_AUTHORIZED" },
        "paidMonitoring": { "const": "NOT_AUTHORIZED" },
        "estimatedMonthlyIncrementUsd": {
          "anyOf": [{ "const": "NOT_APPROVED" }, { "const": "0.00" }]
        },
        "pricingAsOf": { "$ref": "#/$defs/dateOrNotApproved" },
        "pricingExpiresAt": { "$ref": "#/$defs/dateOrNotApproved" },
        "pricingSourceReference": { "$ref": "#/$defs/referenceOrNotApproved" }
      }
    },
    "authority": {
      "type": "object",
      "additionalProperties": false,
      "required": [
        "certificateRequestApprovers",
        "dnsChangeApprovers",
        "cutoverApprovers",
        "rollbackApprovers"
      ],
      "properties": {
        "certificateRequestApprovers": { "$ref": "#/$defs/roleAliasArray" },
        "dnsChangeApprovers": { "$ref": "#/$defs/roleAliasArray" },
        "cutoverApprovers": { "$ref": "#/$defs/roleAliasArray" },
        "rollbackApprovers": { "$ref": "#/$defs/roleAliasArray" }
      }
    },
    "independentVerification": {
      "type": "object",
      "additionalProperties": false,
      "required": ["verifier", "decision", "verifiedAt"],
      "properties": {
        "verifier": { "$ref": "#/$defs/roleAliasOrNotApproved" },
        "decision": { "enum": ["NOT_APPROVED", "APPROVED"] },
        "verifiedAt": { "$ref": "#/$defs/instantOrNotRun" }
      }
    },
    "evidence": {
      "type": "object",
      "additionalProperties": false,
      "required": [
        "hostnameOwnership",
        "certificateIssued",
        "dnsValidation",
        "dnsCutover",
        "tlsChainAndHostname",
        "httpRedirect",
        "unexpectedHostRejected",
        "expirationMonitoring",
        "rollbackDrill",
        "observedAtUtc",
        "evidenceIndexReference"
      ],
      "properties": {
        "hostnameOwnership": { "$ref": "#/$defs/evidenceResult" },
        "certificateIssued": { "$ref": "#/$defs/evidenceResult" },
        "dnsValidation": { "$ref": "#/$defs/evidenceResult" },
        "dnsCutover": { "$ref": "#/$defs/evidenceResult" },
        "tlsChainAndHostname": { "$ref": "#/$defs/evidenceResult" },
        "httpRedirect": { "$ref": "#/$defs/evidenceResult" },
        "unexpectedHostRejected": { "$ref": "#/$defs/evidenceResult" },
        "expirationMonitoring": { "$ref": "#/$defs/evidenceResult" },
        "rollbackDrill": { "$ref": "#/$defs/evidenceResult" },
        "observedAtUtc": { "$ref": "#/$defs/instantOrNotRun" },
        "evidenceIndexReference": {
          "anyOf": [{ "const": "NOT_RUN" }, { "$ref": "#/$defs/reference" }]
        }
      }
    }
  },
  "$defs": {
    "reference": {
      "type": "string",
      "pattern": "^[A-Za-z0-9][A-Za-z0-9._:/#-]{2,127}$"
    },
    "referenceOrNotApproved": {
      "anyOf": [{ "const": "NOT_APPROVED" }, { "$ref": "#/$defs/reference" }]
    },
    "roleAlias": {
      "type": "string",
      "pattern": "^[a-z][a-z0-9-]{1,62}[a-z0-9]$"
    },
    "roleAliasOrNotApproved": {
      "anyOf": [{ "const": "NOT_APPROVED" }, { "$ref": "#/$defs/roleAlias" }]
    },
    "roleAliasArray": {
      "type": "array",
      "minItems": 1,
      "uniqueItems": true,
      "items": {
        "anyOf": [{ "const": "NOT_APPROVED" }, { "$ref": "#/$defs/roleAlias" }]
      }
    },
    "hostname": {
      "type": "string",
      "pattern": "^(?=.{1,253}$)(?:[a-z0-9](?:[a-z0-9-]{0,61}[a-z0-9])?\\.)+[a-z](?:[a-z0-9-]{0,61}[a-z0-9])$"
    },
    "hostnameOrNotApproved": {
      "anyOf": [{ "const": "NOT_APPROVED" }, { "$ref": "#/$defs/hostname" }]
    },
    "hostnameOrNotRun": {
      "anyOf": [{ "const": "NOT_RUN" }, { "$ref": "#/$defs/hostname" }]
    },
    "instant": {
      "type": "string",
      "format": "date-time",
      "pattern": "^\\d{4}-\\d{2}-\\d{2}T\\d{2}:\\d{2}:\\d{2}(?:\\.\\d{1,3})?Z$"
    },
    "instantOrNotApproved": {
      "anyOf": [{ "const": "NOT_APPROVED" }, { "$ref": "#/$defs/instant" }]
    },
    "instantOrNotRun": {
      "anyOf": [{ "const": "NOT_RUN" }, { "$ref": "#/$defs/instant" }]
    },
    "date": {
      "type": "string",
      "format": "date",
      "pattern": "^\\d{4}-\\d{2}-\\d{2}$"
    },
    "dateOrNotApproved": {
      "anyOf": [{ "const": "NOT_APPROVED" }, { "$ref": "#/$defs/date" }]
    },
    "evidenceResult": { "enum": ["NOT_RUN", "PASS", "FAIL"] }
  }
}
